{
  "graphId": "2d1b8cd5-1bd1-4b9a-8a6b-6dcfb678ff6c",
  "version": "1.0",
  "nodes": [
    {
      "nodeId": "step_0",
      "type": "navigate",
      "stepIndex": 0,
      "gherkinStep": {
        "keyword": "given",
        "text": "User opens the login page."
      },
      "execution": {
        "state": "success",
        "duration": 3472,
        "cached": false,
        "cacheKey": "e8c4cd1e0fa470c6d57d54054da6090321a022351011bcc02d6c41c6eff5ad5c",
        "completedAt": "2025-11-12T07:25:32.053Z"
      },
      "instructions": {
        "natural": "User opens the login page.",
        "deterministic": {
          "selector": "xpath=/",
          "action": "click"
        }
      },
      "metadata": {
        "selectorHintText": "RootWebArea"
      }
    },
    {
      "nodeId": "step_1",
      "type": "navigate",
      "stepIndex": 1,
      "gherkinStep": {
        "keyword": "given",
        "text": "User enters a valid email and password combination."
      },
      "execution": {
        "state": "success",
        "duration": 2199,
        "cached": false,
        "cacheKey": "c4e30186a323a6f9a04d10cb3ae224119bb2fc18cb46677b21b0746f0c68dde7",
        "completedAt": "2025-11-12T07:25:35.526Z"
      },
      "instructions": {
        "natural": "User enters a valid email and password combination.",
        "deterministic": {
          "selector": "xpath=/html[1]",
          "action": "fill"
        }
      },
      "metadata": {
        "selectorHintText": "scrollable, html"
      }
    },
    {
      "nodeId": "step_2",
      "type": "navigate",
      "stepIndex": 2,
      "gherkinStep": {
        "keyword": "given",
        "text": "click on login button to log user incorrect."
      },
      "execution": {
        "state": "success",
        "duration": 2089,
        "cached": false,
        "cacheKey": "eed8a6f1d89453c42cccc0d847b934de77058cf434cf9df7805d63cc8a62bde4",
        "completedAt": "2025-11-12T07:25:37.725Z"
      },
      "instructions": {
        "natural": "click on login button to log user incorrect.",
        "deterministic": {
          "selector": "xpath=/",
          "action": "click"
        }
      },
      "metadata": {
        "selectorHintText": "RootWebArea"
      }
    }
  ],
  "edges": [
    {
      "from": "step_0",
      "to": "step_1",
      "type": "sequential"
    },
    {
      "from": "step_1",
      "to": "step_2",
      "type": "sequential"
    }
  ],
  "metadata": {
    "createdAt": "2025-11-12T07:25:39.815Z",
    "specId": "2add92dde2ee5d37a17c5c487aa4f9744cb9b04f3ab95aaf6682521ac9e3de0a",
    "scenarioName": "Happy path",
    "featureName": "Customer login",
    "authorship": {
      "authoringMode": true,
      "authoredBy": "manual"
    }
  }
}